,Unnamed: 0,id,article,highlights,baseline-abs,bert-base-abs-zs,t5-small-abs-zs,gpt-3.5-abs-zs,gpt-4-abs-zs,bert-base-abs-ft,t5-small-abs-ft,gpt-3.5-abs-ft,gpt-4-abs-ft
12,12,67f7110c19df40e51f2a6ba92ad77356e510a4fb,"England captain Alastair Cook completed a much-needed century on the second morning of England's opening tour match in the West Indies. Cook resumed on 95 and reached three figures with minimal fuss before retiring out. England captain Alastair Cook completed a century on the second morning of England's opening tour match . A controlled thick edge from the first ball of the day brought him an 11th boundary of the innings and in the following over he punched the ball for two off the back foot. He offered a gentle wave of the bat and a handshake to partner Gary Ballance and walked off on 101 from 200 deliveries. That allowed Ian Bell to arrive at the crease, with batting time more important to the tourists than attempting to force a result in this two-day fixture. Ian Bell plays to the offside during day two of the St Kitts and Nevis Invitational XI versus England tour match .","Alastair Cook completed his century on the second morning of action .
England captain resumed on 95 and reached three figures before retiring .
That allowed Ian Bell to arrive at the crease as tourists continued to bat .","England captain Alastair Cook completed a much-needed century on the second morning of England's opening tour match in the West Indies.
Cook resumed on 95 and reached three figures with minimal fuss before retiring out.
England captain Alastair Cook completed a century on the second morning of England's opening tour match .","england captain alastair cook completed a much - needed century on the second morning of england ' s opening tour match in the west indies.
cook resumed on 95 and reached three figures with minimal fuss before retiring out.
england captain alastair cook completed a century on the second morning of england ' s opening tour match.
a controlled thick edge from the first ball of the day brought him an 11th boundary of the innings and in the following over he punched the ball for two off the back foot.
he offered a g.",captain alastair cook completed a century on the second morning of the opening tour match in the west indies .nhe resumed on 95 and reached three figures with minimal fuss before retiring .,"England captain Alastair Cook scored a century on the second day of England's opening tour match against St Kitts and Nevis Invitational XI in the West Indies. He came back with a controlled thick edge from the first ball of the day, completing his century with minimal fuss before retiring out. After his retirement, Ian Bell arrived at the crease, with batting time more important to the tourists than attempting to force a result in this two-day fixture.","Alastair Cook, the England captain, achieved a century on the second day of England's first tour match in the West Indies, starting the day at 95 and reaching his hundred with an 11th boundary from the day's first ball and then a two-run punch in the next over. Cook retired out after reaching 101 from 200 deliveries, acknowledging his partner Gary Ballance and making way for Ian Bell to join the action. The focus for England was on gaining batting experience rather than pushing for a win in this two-day game.",england captain alastair cook completed a century on the second morning of england's opening tour match in the west indies. cook resumed on 95 and reached three figures with minimal fuss before retiring out. ian bell and gary ballance walked off on 101 from 200 deliveries. england take on england at the st kitts and nevis invitational xi.,"[""England captain Alastair Cook completed a much-needed century on the second morning of England's opening tour match in the West Indies. Cook resumed on 95 and reached three figures with minimal fuss before retiring out. Ian Bell arrived at the crease, with batting time more important to the tourists than trying to force a result.""]","England's captain, Alastair Cook, completed a century during the second morning of England's tour match against the West Indies. Cook resumed his game on 95 and effortlessly scored his 11th boundary with the first ball of the day. Cook retired out after reaching 101 from 200 deliveries, allowing Ian Bell to take the crease. England focused on batting time, prioritising it over attempting to force a result in the two-day fixture.","Alastair Cook, the England captain, achieved a century on the second day of England's opening tour match in the West Indies, starting the day on 95 and gracefully reaching 100 before retiring. His century, marked by a controlled edge and a two-run punch off the back foot, came from 200 deliveries, signifying a return to form. After reaching his milestone, he was replaced by Ian Bell, signaling a shift in England's batting strategy towards gaining time in the middle rather than pushing for a win in the two-day game. Cook's performance and Bell's appearance at the crease highlighted the tourists' focus on preparation and form heading into more consequential matches."
13,13,391b4610e3a9dcefd61e428155cc5afb2683124c,"(CNN)Warren Weinstein, who appears to have been the only American citizen held hostage by al Qaeda, was accidentally killed in a U.S. drone strike in January. But it didn't have to be that way. A senior U.S. official familiar with the handling of the issue told CNN that the U.S. government made no serious effort to negotiate for the 73-year-old development expert's release, either directly to al Qaeda or through proxies in Pakistan. Another senior U.S. official told CNN that Weinstein's capture by al Qaeda made it hard for the United States to negotiate, even though proxies such as the Pakistani government have links to intermediaries who might have helped. A senior Pakistani official told CNN that after Weinstein was kidnapped, the Pakistani government put out feelers to members of the militant Haqqani Network and to the Pakistani Taliban, which are both allied to al Qaeda, to see if these groups might be able to initiate some kind of negotiation about Weinstein. According to the official, nothing came of those feelers. The senior Pakistani official says that during the past year Pakistani soldiers, who were part of a military offensive in the tribal area of North Waziristan near the Afghan-Pakistan border where Weinstein was believed to be being held, went door-to-door looking for the American. Nothing came of this search either. On Thursday, the U.S. government announced that Weinstein had been killed in a ""counterterrorism operation"" in January, which is how the government often describes CIA drone strikes. According to New America, which tracks drone strikes in Pakistan, CIA drone attacks happened in Shawal, North Waziristan, on January 19 in which at least four militants were killed; also on January 15 in Tehsil Ladha, South Waziristan, in which at least five militants were killed; and on January 4 in Datta Khel, South Waziristan, in which at least eight militants were killed. It is in one of these strikes that Weinstein was almost certainly killed. Lt. Col. Jason Amerine, a planner on the U.S. Army staff, is under investigation over a purported unauthorized disclosure to U.S. Rep. Duncan Hunter's office, which has demonstrated a strong interest in the fate of American hostages held by al Qaeda and the Taliban. A plan was developed in the Pentagon to secure the release of Weinstein, according to a staff member on Hunter's committee. That plan was to release Haji Bashir Noorzai, a prominent and influential member of the Taliban who is in prison in the States on drug trafficking charges, in exchange for U.S. Army Sgt. Bowe Berghdal, who was held by the Taliban until last year; Taliban hostages Caitlin Coleman, a U.S. citizen, and her husband, Canadian Joshua Boyle; and Dr. Shakil Afridi, who spied for the CIA in Pakistan and was being held in a Pakistani prison, as well as Weinstein. It's not clear how far this plan of action went. Amerine is invoking whistleblower protection and denies making an unauthorized disclosure. Hunter, a California Republican, released a statement Thursday, saying, ""The only government organization seriously developing options to recover Weinstein and others in the Afghanistan/Pakistan region was within the Pentagon -- led by war hero Jason Amerine."" As an Army captain, Amerine led a small detachment of U.S. Special Forces into Afghanistan in November 2001 in the wake of the September 11 attacks on the United States. The operation was instrumental in helping to topple the Taliban and to install Hamid Karzai as the new leader of Afghanistan. Who exactly carried out Weinstein's kidnapping from his house 3½  years ago in the Pakistani megacity of Lahore has until now not been clear. A senior Pakistani counterterrorism official told CNN that members of the Islamic Movement of Uzbekistan, or IMU, kidnapped Weinstein at his Lahore home on August 13, 2011. IMU is an Uzbek terrorist group headquartered in the tribal regions of Pakistan along its border with Afghanistan. According to the Pakistani official, the leader of the Weinstein kidnapping cell was a relative of Tahir Yuldashev, the former IMU leader killed in a CIA drone strike in the Pakistani tribal regions in 2009. The initial lead that traced the Weinstein kidnapping to the IMU came from another high-profile kidnapping in Pakistan two weeks after Weinstein's abduction. Shahbaz Taseer, the son of a leading Pakistani liberal politician Salman Taseer -- who was killed by Pakistani militants eight months earlier -- was kidnapped in Lahore on August 26, 2011. At the scene of Taseer's kidnapping one of the kidnappers dropped a cell phone and SIM card that eventually led Pakistani officials to focus on the IMU group in Lahore, according to the senior Pakistani counterterrorism official. The police subsequently arrested three Uzbeks and four Pakistanis who were part of the IMU cell that had carried out the Weinstein kidnapping. Members of the IMU cell told Pakistani interrogators that after they had kidnapped Weinstein they moved him while he was tranquilized and semi-conscious among three safe houses in Lahore. IMU members then took Weinstein to the Federally Administered Tribal Areas in Pakistan, a semi-autonomous region along the border with Afghanistan where al Qaeda and other militant groups are headquartered. There Weinstein was given or, more likely, sold to al Qaeda, according to the senior Pakistani official. Who was Warren Weinstein? Weinstein had spent his life helping others, working in the fields of aid and development. He held a doctorate in international law and economics from Columbia University and spoke more than half a dozen languages. After his capture, the leader of al Qaeda, Ayman al-Zawahiri, demanded the end of CIA drone strikes in Pakistan and the release of terrorists held in U.S. custody in exchange for Weinstein's freedom. On September 12, 2012, Weinstein appeared in a video produced by al Qaeda's production arm in which he said that the Obama administration had shown ""no interest in my case."" He then appealed to Israeli Prime Minister Benjamin Netanyahu from ""one Jew to another"" to intervene. The Obama administration is in the midst of a review of its hostage policy, which has been criticized by some families whose loved ones have been taken hostage by ISIS, al Qaeda or the Taliban. The key problems these families point to are lack of communication by the U.S. government about their loved ones and a lack of coordination within the government about how best to free them. The CIA, for instance, is focused on drone strikes and counterterrorism operations, while the FBI has responsibility for retrieving American hostages. Often these goals are not in alignment -- as was clearly the case with Weinstein. The CIA could have exercised more due diligence knowing that Weinstein was almost certainly being held in North Waziristan. There are some solutions for these problems. First, families should be granted security clearances by the U.S. government for the purpose of having classified information disclosed to them only about their captive loved ones. Right now, the U.S. government won't communicate much with the families about their loved ones because the relatives don't have the requisite security clearances. Should families abuse their clearances, they would no longer receive classified information about their loved ones, which is a strong incentive not to abuse them. Second, President Barack Obama should appoint a senior-level person, perhaps working in the White House on the National Security Council, to oversee the work of the CIA, FBI, State Department and the Joint Special Operations Command, which implements hostage rescues. All these organizations have key roles to play in getting American hostages home. That person must be sufficiently senior so he or she can make all the relevant agencies play well together and ""de-conflict"" any potential issues, such as the ones that surfaced in the Weinstein case. Third, while the U.S. government position is that it will not make concessions to terrorist groups, there is nothing in American policy to prevent another government from negotiating with terrorists to secure the release of U.S. citizens, and this should be encouraged, even if there is some quid pro quo involved. This is what happened in the case of the American journalist Peter Theo Curtis, who was captured by al Qaeda's affiliate in Syria in 2012, but was released last year after the Qatari government intervened in his case. The Qataris have had longstanding ties to the militant groups in Syria, including the al Qaeda affiliate holding Curtis, and while Qatari officials have denied paying ransom to free Curtis, it's unlikely that the journalist was freed just because the members of al Qaeda holding him were suddenly feeling like good guys. Curtis' successful release could provide a ray of hope for U.S. citizen Caitlin Coleman and her husband, Canadian Joshua Boyle, who were captured by the Taliban in 2012 when they were traveling on a trip through Afghanistan. A senior American official told CNN they are being held by the Haqqani Network. The Pakistani government has contacts with the Haqqani Network, and the U.S. government should ratchet up the pressure on the Pakistani government to secure the couple's release. In captivity, Coleman, who was pregnant at the time she was taken hostage, had a child. The name of the child is unknown.","U.S. hostage Warren Weinstein is believed to have been accidentally killed in counter-terrorism strike .
Peter Bergen: U.S. should rethink hostage policy to increase chances of freeing those held .","(CNN)Warren Weinstein, who appears to have been the only American citizen held hostage by al Qaeda, was accidentally killed in a U.S. drone strike in January.
But it didn't have to be that way.
A senior U.S. official familiar with the handling of the issue told CNN that the U.S. government made no serious effort to negotiate for the 73-year-old development expert's release, either directly to al Qaeda or through proxies in Pakistan.","( cnn ) warren weinstein, who appears to have been the only american citizen held hostage by al qaeda, was accidentally killed in a u. s. drone strike in january.
but it didn ' t have to be that way.
a senior u. s. official familiar with the handling of the issue told cnn that the u. s. government made no serious effort to negotiate for the 73 - year - old development expert ' s release, either directly to al qaeda or through proxies in pakistan.
another senior u. s. official told cnn that weinstein ' s capture by al qaeda.","a senior u.s. official says the 73-year-old was kidnapped by al Qaeda in 2011 .nhe says a plan was developed in the Pentagon to secure the release of Weinstein .n""the only government organization seriously developing options to recover Weinstein,"" he writes .nsome families have been criticized for lack of communication by the government .","Warren Weinstein, the only American citizen held captive by al Qaeda, was killed in a U.S. drone strike after the U.S. government made no serious effort to negotiate for his release. A plan developed by the Pentagon to secure Weinstein's release may have involved a prisoner swap for Taliban and al Qaeda hostages, but it is unclear how far the plan went. Members of the Islamic Movement of Uzbekistan, a terrorist group in Pakistan, kidnapped Weinstein from his Lahore home in 2011 and sold him to al Qaeda. Solutions to the U.S. government's lack of coordination and communication regarding hostages include granting security clearances to families, appointing a senior-level overseer of multiple agencies, and encouraging governments to negotiate with terrorists for the release of U.S. citizens. The successful release of American journalist Peter Theo Curtis provides hope for the release of Caitlin Coleman and her husband, who are being held by the Haqqani Network.","Warren Weinstein, the only American citizen held hostage by al Qaeda, was accidentally killed in a U.S. drone strike in January. A senior U.S. official revealed that the U.S. government made no significant effort to negotiate for Weinstein's release, either directly with al Qaeda or through Pakistani intermediaries. Despite Pakistan's attempts to initiate negotiations using connections with militant groups allied to al Qaeda, these efforts bore no results. The U.S. government announced that Weinstein's death occurred during a ""counterterrorism operation,"" with CIA drone strikes in Pakistan around the period he was likely killed. A Pentagon plan for Weinstein's release involved exchanging prisoners with the Taliban but its progress remains unclear. Weinstein, with a lifetime dedicated to aid work, was captured by members of the Islamic Movement of Uzbekistan and later handed to al Qaeda. Amidst criticism of the U.S. hostage policy, there are calls for better coordination within the government and more open communication with hostages' families. Suggestions for improvement include security clearances for families, appointing a senior official to oversee hostage rescue efforts, and encouraging negotiations through third countries.","u. s. official : warren weinstein was accidentally killed in a drone strike in january. pakistani government put out feelers to members of the militant haqqani network and to the pakistani taliban. weinstein, who appears to have been the only american hostage by al qaeda, was killed.","[""A senior U.S. official says the U.S. government made no serious effort to negotiate for Weinstein's release. He was kidnapped by al Qaeda in 2011 and released last year. The family of Peter Theo Curtis should get their loved ones back.""]","Warren Weinstein, an American citizen held hostage by Al Qaeda, was accidentally killed in a US drone strike in January. Reports reveal that the US government did not attempt to negotiate his release, either directly to Al Qaeda or through proxies in Pakistan, despite the fact that a plan was developed in the Pentagon to secure his release. Critics have cited the lack of effective coordination within the government as the key problem with US hostage policy. Weinstein's successful release could provide a ray of hope for other US citizens currently held hostage by terrorist groups, such as Caitlin Coleman and her husband.
","Warren Weinstein, an American citizen and development expert, was accidentally killed in a U.S. drone strike in January, after being held hostage by al Qaeda. Senior U.S. officials revealed to CNN that the government made no significant attempts to negotiate Weinstein's release either directly or through proxies in Pakistan. Despite Pakistan's efforts, including using contacts within militant groups and conducting door-to-door searches, no progress was made in securing his release. Weinstein's death was announced as part of a ""counterterrorism operation,"" with it being highly likely he was killed in one of several CIA drone strikes in North Waziristan. Moreover, Lt. Col. Jason Amerine faced investigation for allegedly unauthorized disclosures related to a plan involving the exchange of prominent prisoners for American hostages, including Weinstein. Weinstein's capture, attributed to the Islamic Movement of Uzbekistan, and his eventual sale to al Qaeda, underscored the complexity of hostage situations in the region. His death highlights criticisms of the U.S. government's hostage policy, particularly regarding coordination among agencies and communication with hostages' families. Suggestions for improvement include granting families security clearances for receiving information and appointing a senior-level overseer for hostage retrieval efforts. The U.S. maintains a policy against making concessions to terrorists, though it does not prevent other governments from negotiating to secure U.S. citizens' release, emphasizing a potential method for future negotiations."
