,Unnamed: 0.1,Unnamed: 0,id,highlights,article,baseline-ext,bert-base-ext-zs,t5-small-ext-zs,gpt-3.5-ext-zs,gpt-4-ext-zs,bert-base-ext-ft,gpt35-ext-ft,gpt40-ext-ft
0,0,0,92c514c913c0bdfe25341af9fd72b29db544099b,"Experts question if  packed out planes are putting passengers at risk .
U.S consumer advisory group says minimum space must be stipulated .
Safety tests conducted on planes with more leg room than airlines offer .",Ever noticed how plane seats appear to be getting smaller and smaller With increasing numbers of people taking to the skies some experts are questioning if having such packed out planes is putting passengers at risk. They say that the shrinking space on aeroplanes is not only uncomfortable it s putting our health and safety in danger. More than squabbling over the arm rest shrinking space on planes putting our health and safety in danger This week a U.S consumer advisory group set up by the Department of Transportation said at a public hearing that while the government is happy to set standards for animals flying on planes it does not stipulate a minimum amount of space for humans. In a world where animals have more rights to space and food than humans said Charlie Leocha consumer representative on the committee. It is time that the DOT and FAA take a stand for humane treatment of passengers. But could crowding on planes lead to more serious issues than fighting for space in the overhead lockers crashing elbows and seat back kicking Tests conducted by the FAA use planes with a 31 inch pitch a standard which on some airlines has decreased . Many economy seats on United Airlines have 30 inches of room while some airlines offer as little as 28 inches . Cynthia Corbertt a human factors researcher with the Federal Aviation Administration that it conducts tests on how quickly passengers can leave a plane. But these tests are conducted using planes with 31 inches between each row of seats a standard which on some airlines has decreased reported the Detroit News. The distance between two seats from one point on a seat to the same point on the seat behind it is known as the pitch. While most airlines stick to a pitch of 31 inches or above some fall below this. While United Airlines has 30 inches of space Gulf Air economy seats have between 29 and 32 inches Air Asia offers 29 inches and Spirit Airlines offers just 28 inches. British Airways has a seat pitch of 31 inches while easyJet has 29 inches Thomson s short haul seat pitch is 28 inches and Virgin Atlantic s is 30 31.,"Ever noticed how plane seats appear to be getting smaller and smaller With increasing numbers of people taking to the skies some experts are questioning if having such packed out planes is putting passengers at risk.
They say that the shrinking space on aeroplanes is not only uncomfortable it s putting our health and safety in danger.
More than squabbling over the arm rest shrinking space on planes putting our health and safety in danger This week a U.S consumer advisory group set up by the Department of Transportation said at a public hearing that while the government is happy to set standards for animals flying on planes it does not stipulate a minimum amount of space for humans.
In a world where animals have more rights to space and food than humans said Charlie Leocha consumer representative on the committee.
It is time that the DOT and FAA take a stand for humane treatment of passengers.",Ever noticed how plane seats appear to be getting smaller and smaller With increasing numbers of people taking to the skies some experts are questioning if having such packed out planes is putting passengers at risk. It is time that the DOT and FAA take a stand for humane treatment of passengers. But could crowding on planes lead to more serious issues than fighting for space in the overhead lockers crashing elbows and seat back kicking Tests conducted by the FAA use planes with a 31 inch pitch a standard which on some airlines has decreased .,some experts are questioning if shrinking space on planes is putting our health and safety in danger .na consumer advisory group set up by the department of transportation said it does not stipulate a minimum amount of space for humans .nit is time that the DOT and FAA take a stand for humane treatment .,"Experts are concerned that the shrinking space on aeroplanes is putting passengers at risk, not just making them uncomfortable. The US Department of Transportation does not stipulate a minimum amount of space for humans, leading a consumer advisory group to call for a stand for humane treatment of passengers. Tests conducted by the Federal Aviation Administration (FAA) on how quickly passengers can leave a plane are conducted using planes with a standard pitch of 31 inches, which has decreased on some airlines, such as United Airlines with 30 inches and some airlines with as little as 28 inches. This could lead to serious safety issues, as passengers may not be able to evacuate quickly in an emergency.","Experts argue that the diminishing space on planes is not just uncomfortable, but also a danger to passengers' health and safety, with the situation worsening as more people fly. The U.S. Department of Transportation's consumer advisory group highlighted that, unlike for animals, there is no minimum space requirement for humans on planes. This lack of regulation is criticized, especially when some airlines have reduced the seat pitch—the distance between seats—to less than the 31 inches used in Federal Aviation Administration (FAA) safety tests. For instance, United Airlines' economy seats offer only 30 inches, while Spirit Airlines goes as low as 28 inches, raising concerns about the humane treatment of passengers and potential risks in emergency evacuations.",the dot and faa are happy to set standards for animals flying on planes it does not stipulate a minimum amount of space for humans. many economy seats on united airlines have 30 inches of room while some airlines offer as little as 28 inches between each row of seats a standard which on some airlines has decreased.,Experts are questioning if having such packed out planes is putting passengers at risk. Shrinking space on aeroplanes is putting our health and safety in danger. A U.S consumer advisory group said that while the government is happy to set standards for animals flying on planes it does not stipulate a minimum amount,"```
Ever noticed how plane seats appear to be getting smaller and smaller With increasing numbers of people taking to the skies some experts are questioning if having such packed out planes is putting passengers at risk.
They say that the shrinking space on aeroplanes is not only uncomfortable it s putting our health and safety"
2,2,2,91b7d2311527f5c2b63a65ca98d21d9c92485149,"Nottingham Forest are close to extending Dougie Freedman's contract .
The Forest boss took over from former manager Stuart Pearce in February .
Freedman has since lead the club to ninth in the Championship .",Dougie Freedman is on the verge of agreeing a new two year deal to remain at Nottingham Forest. Freedman has stabilised Forest since he replaced cult hero Stuart Pearce and the club s owners are pleased with the job he has done at the City Ground. Dougie Freedman is set to sign a new deal at Nottingham Forest . Freedman has impressed at the City Ground since replacing Stuart Pearce in February . They made an audacious attempt on the play off places when Freedman replaced Pearce but have tailed off in recent weeks. That has not prevented Forest s ownership making moves to secure Freedman on a contract for the next two seasons.,"Dougie Freedman is on the verge of agreeing a new two year deal to remain at Nottingham Forest.
Freedman has stabilised Forest since he replaced cult hero Stuart Pearce and the club s owners are pleased with the job he has done at the City Ground.
Dougie Freedman is set to sign a new deal at Nottingham Forest .
Freedman has impressed at the City Ground since replacing Stuart Pearce in February .
They made an audacious attempt on the play off places when Freedman replaced Pearce but have tailed off in recent weeks.",Dougie Freedman is on the verge of agreeing a new two year deal to remain at Nottingham Forest. They made an audacious attempt on the play off places when Freedman replaced Pearce but have tailed off in recent weeks.,Dougie Freedman is set to sign a new two year deal at Nottingham Forest .nfreedman replaced cult hero Stuart Pearce in february .nthe club s owners are pleased with the job he has done at the City Ground .,"Dougie Freedman is close to agreeing to a new two-year contract at Nottingham Forest, having impressed the club's owners since replacing Stuart Pearce as manager in February. Despite the team's recent dip in form, the owners remain pleased with Freedman's work in stabilizing the squad and making a push for the playoffs earlier in the season.","Dougie Freedman is poised to sign a new two-year deal to stay at Nottingham Forest, having impressed the club's owners by stabilizing the team since taking over from Stuart Pearce in February. Despite a recent dip in form following an audacious push for the playoffs, Forest is moving forward with securing Freedman's leadership for the coming seasons.",dougie freedman is set to sign a new two year deal at nottingham forest. freedman has impressed at the city ground since replacing stuart pearce in february. the club are pleased with freedman's job he has done at the club. forest have tailed off forest in recent weeks to secure freedman on a contract.,"Nottingham Forest's manager, Dougie Freedman, is close to signing a new two-year deal with the club. Freedman has been successful in stabilizing the team since taking over from Stuart Pearce in February. The club's owners are pleased with Freedman's performance and have made moves to secure","```
Dougie Freedman is on the verge of agreeing a new two year deal to remain at Nottingham Forest.
Freedman has stabilised Forest since he replaced cult hero Stuart Pearce and the club s owners are pleased with the job he has done at the City Ground.
Dougie Freedman is"
3,3,3,caabf9cbdf96eb1410295a673e953d304391bfbb,"Fiorentina goalkeeper Neto has been linked with Liverpool and Arsenal .
Neto joined Firoentina from Brazilian outfit Atletico Paranaense in 2011 .
He is also wanted by PSG and Spanish clubs, according to his agent .
CLICK HERE for the latest Liverpool news .",Liverpool target Neto is also wanted by PSG and clubs in Spain as Brendan Rodgers faces stiff competition to land the Fiorentina goalkeeper according to the Brazilian s agent Stefano Castagna. The Reds were linked with a move for the 25 year old whose contract expires in June earlier in the season when Simon Mignolet was dropped from the side. A January move for Neto never materialised but the former Atletico Paranaense keeper looks certain to leave the Florence based club in the summer. Neto rushes from his goal as Juan Iturbe bears down on him during Fiorentina s clash with Roma in March . Neto is wanted by a number of top European clubs including Liverpool and PSG according to his agent . It had been reported that Neto had a verbal agreement to join Serie A champions Juventus at the end of the season but his agent has revealed no decision about his future has been made yet. And Castagna claims Neto will have his pick of top European clubs when the transfer window re opens in the summer including Brendan Rodgers side. There are many European clubs interested in Neto such as for example Liverpool and Paris Saint Germain Stefano Castagna is quoted as saying by Gazzetta TV. Firoentina goalkeeper Neto saves at the feet of Tottenham midfielder Nacer Chadli in the Europa League . In Spain too there are clubs at the very top level who are tracking him. Real Madrid We will see. We have not made a definitive decision but in any case he will not accept another loan move elsewhere. Neto who represented Brazil at the London 2012 Olympics but has not featured for the senior side was warned against joining a club as a No 2 by national coach Dunga. Neto joined Fiorentina from Atletico Paranaense in 2011 and established himself as No1 in the last two seasons.,"Liverpool target Neto is also wanted by PSG and clubs in Spain as Brendan Rodgers faces stiff competition to land the Fiorentina goalkeeper according to the Brazilian s agent Stefano Castagna.
The Reds were linked with a move for the 25 year old whose contract expires in June earlier in the season when Simon Mignolet was dropped from the side.
A January move for Neto never materialised but the former Atletico Paranaense keeper looks certain to leave the Florence based club in the summer.
Neto rushes from his goal as Juan Iturbe bears down on him during Fiorentina s clash with Roma in March .
Neto is wanted by a number of top European clubs including Liverpool and PSG according to his agent .",Liverpool target Neto is also wanted by PSG and clubs in Spain as Brendan Rodgers faces stiff competition to land the Fiorentina goalkeeper according to the Brazilian s agent Stefano Castagna. And Castagna claims Neto will have his pick of top European clubs when the transfer window re opens in the summer including Brendan Rodgers side. We have not made a definitive decision but in any case he will not accept another loan move elsewhere.,neto is wanted by a number of top european clubs including Liverpool and PSG according to his agent .nthe 25-year-old is also wanted by clubs in the spanish capital .na move for the former atletico paranaense keeper expires in June .,"Fiorentina goalkeeper Neto, who has been linked to Liverpool since Mignolet was dropped, is also wanted by PSG and Spanish clubs. Neto's agent, Stefano Castagna, revealed there has been no decision about the goalkeeper's future, but he will certainly be leaving Fiorentina this summer. Castagna claims Neto will have his pick of top European clubs when the transfer window re-opens, including Brendan Rodgers' Liverpool. Neto has attracted interest from Real Madrid, but he will not accept a loan move elsewhere.","Liverpool are interested in signing Neto, the Fiorentina goalkeeper, whose contract expires in June. His agent, Stefano Castagna, mentions PSG and several top Spanish clubs alongside Liverpool as interested parties. There have been reports of a verbal agreement with Juventus, but Castagna indicates no decision on Neto's future has been made. Neto, who has become Fiorentina's first-choice goalkeeper and represented Brazil at the London 2012 Olympics, is set to leave the Florence-based club in the summer, with his agent ensuring he will not accept another loan move.",liverpool and psg were linked with a move for the 25 - year - old whose contract expires in june. brendan rodgers faces stiff competition to land the fiorentina goalkeeper according to his agent. neto is also wanted by psg and european clubs in spain. click here for more liverpool transfer news.,"Liverpool face competition from PSG and Spanish clubs for Fiorentina goalkeeper Neto, whose contract expires in June. The 25-year-old was linked with a move to Liverpool earlier in the season, but a January move never materialised. Neto had reportedly agreed to join Juventus, but his agent has","```
Liverpool target Neto is also wanted by PSG and clubs in Spain as Brendan Rodgers faces stiff competition to land the Fiorentina goalkeeper according to the Brazilian s agent Stefano Castagna.
A January move for Neto never materialised but the former Atletico Paranaense keeper looks certain"
4,4,4,3da746a7d9afcaa659088c8366ef6347fe6b53ea,"Tell-all interview with the reality TV star, 69, will air on Friday April 24 .
It comes amid continuing speculation about his transition to a woman and following his involvement in a deadly car crash in February .
The interview will also be one of Diane Sawyer's first appearances on television following the sudden death of her husband last year .",Bruce Jenner will break his silence in a two hour interview with Diane Sawyer later this month. The former Olympian and reality TV star 65 will speak in a far ranging interview with Sawyer for a special edition of 20/20 on Friday April 24 ABC News announced on Monday. The interview comes amid growing speculation about the father of six s transition to a woman and follows closely behind his involvement in a deadly car crash in California in February. And while the Kardashian women are known for enjoying center stage they will not be stealing Bruce s spotlight because they will be in Armenia when the interview airs according to TMZ. Scroll down for video . Speaking out Bruce Jenner pictured on Keeping Up with the Kardashians will speak out in a far ranging interview with Diane Sawyer later this month ABC News announced on Monday . Return Diane Sawyer who recently mourned the loss of her husband will return to ABC for the interview . Rumors started swirling around Jenner s gender identity last year when he emerged from a Beverly Hills clinic with his Adam s apple shaved down. His behavior over the past year also fueled speculation as he began embracing an increasingly female appearance including growing out his hair shaving his legs and painting his nails while reportedly undergoing hormone therapy. He also split from with his wife of more than two decades Kris Jenner with whom he has two daughters Kyle and Kendall. She filed for divorce in September 2014 citing irreconcilable differences . Reports also emerged over the past week that he has received a breast enhancement. Bruce had silicone breast implants put in a few weeks ago a source told RadarOnline. He went with a smaller implant because he did not want to look ridiculous. On Sunday he was seen walking to his car in Malibu but hid his body beneath a bulky sweatshirt. Out and about Jenner was pictured walking back to his car in Malibu on the weekend and hiding beneath a large sweatshirt on Sunday days after reports that he had undergone a breast enhancement . Hiding He also apparently had painted his nails red when he was seen walking on Sunday . According to Radar Jenner wants to have all surgeries completed in time to make his on screen debut as a woman on the fall season of Dancing with the Stars . Jenner is also rumored to be filming a spin off docu series about the transition on E! although his reps have refused to confirm the claims. While Jenner himself has remained silent about his reported transition some of his relatives including step daughter Kim Kardashian have spoken about about his journey . I guess I will kind of let everyone be curious and I feel like that s his journey to talk about Kim recently told Entertainment Tonight. I will say that I think Bruce should tell his story his way. I think everyone goes through things in life and I think that story and what Bruce is going through I think he will share whenever the time is right. Jenner who won gold in the decathlon at the 1976 Olympics also made headlines earlier this year for his involvement in a deadly car crash in Malibu. Deadly In February Jenner s vehicle which was pulling a trailer and an ATV seen right rear ended a woman s car left and pushed it into the lane of an oncoming Hummer. She died at the scene . By his side Bruce pictured with his ex wife Kris Jenner and four of his step children from left Rob Kim Kourtney and Khloe has received support from his family. Kris filed for divorce from him last year . His Cadillac Escalade which was pulling a trailer and off road vehicle plowed into the back of a Lexus and pushed it into the path of an oncoming Hummer on February 7. The Lexus was carrying 69 year old Kim Howe who died from chest trauma at the scene. Police sources say Jenner is unlikely to be prosecuted because he wasn t drinking speeding or texting at the time of the fatal crash. His tell all interview will also be one of Sawyer s first forays back to TV news following the death of her husband acclaimed director Mike Nichols following a heart attack last November. Last September she left the anchor chair of ABC World News and announced that she planned to focus on specials. In February she presented A Nation of Women Behind Bars in which she went to prisons across the country to speak with female inmates.,"Bruce Jenner will break his silence in a two hour interview with Diane Sawyer later this month.
The former Olympian and reality TV star 65 will speak in a far ranging interview with Sawyer for a special edition of 20/20 on Friday April 24 ABC News announced on Monday.
The interview comes amid growing speculation about the father of six s transition to a woman and follows closely behind his involvement in a deadly car crash in California in February.
And while the Kardashian women are known for enjoying center stage they will not be stealing Bruce s spotlight because they will be in Armenia when the interview airs according to TMZ.
Scroll down for video .",Bruce Jenner will break his silence in a two hour interview with Diane Sawyer later this month. The interview comes amid growing speculation about the father of six s transition to a woman and follows closely behind his involvement in a deadly car crash in California in February. Rumors started swirling around Jenner s gender identity last year when he emerged from a Beverly Hills clinic with his Adam s apple shaved down. Out and about Jenner was pictured walking back to his car in Malibu on the weekend and hiding beneath a large sweatshirt on Sunday days after reports that he had undergone a breast enhancement . Hiding He also apparently had painted his nails red when he was seen walking on Sunday . According to Radar Jenner wants to have all surgeries completed in time to make his on screen debut as a woman on the fall season of Dancing with the Stars . Jenner is also rumored to be filming a spin off docu series about the transition on E!,the former Olympian will speak in a two hour interview with Diane Sawyer later this month .nthe interview comes amid growing speculation about the father of six s transition to a woman .nhe is also rumored to be filming a spin off docu series about the transition on E!,"Former Olympian and reality star, Bruce Jenner, will speak to Diane Sawyer in a two-hour interview for ABC's 20/20 later this month. Amidst growing speculation about his transition to a woman and following his involvement in a deadly car crash in February, Jenner will address the rumors in a far-ranging conversation with Sawyer. The Kardashian women will not be stealing his spotlight as they will be in Armenia when the interview airs. The interview will also mark one of Sawyer's first forays back to TV news since the death of her husband, acclaimed director Mike Nichols, last November.","Bruce Jenner will discuss his life and recent events in an extensive two-hour interview with Diane Sawyer on ABC's 20/20, set to air on Friday, April 24. This interview is anticipated amid speculation about Jenner's transition to a woman and follows his involvement in a fatal car accident in California in February. Despite being a part of the spotlight-loving Kardashian family, Jenner will have the stage to himself as the Kardashian women will be in Armenia when the interview broadcasts. Over the past year, Jenner has been seen embracing a more feminine appearance and is rumored to be completing his surgeries in time for an on-screen debut as a woman on ""Dancing with the Stars."" Additionally, Jenner, who won gold at the 1976 Olympics, has been supported by his family through his divorce from Kris Jenner and the aftermath of the deadly car crash that occurred in February, which he is unlikely to be prosecuted for due to lack of reckless behavior. Diane Sawyer, mourning the loss of her husband, returns to ABC News with this interview as one of her notable projects since stepping down from ABC World News.",the interview comes amid growing speculation about the father of six'transition to a woman and follows closely behind his involvement in a deadly car crash in california in february. rumors started swirling around jenner's gender identity last year when he emerged from a beverly hills clinic with his adam s apple shaved down. he is rumored to be filming a spin off docu series about the transition on e!,"Bruce Jenner, the former Olympian and reality TV star, will speak in a two-hour interview with Diane Sawyer later this month. The interview comes amid growing speculation about his transition to a woman and follows closely behind his involvement in a deadly car crash in California in February. Jenner has been fueling speculation","Bruce Jenner will break his silence in a two hour interview with Diane Sawyer later this month.
The interview comes amid growing speculation about the father of six s transition to a woman and follows closely behind his involvement in a deadly car crash in California in February.
Rumors started swirling around Jenner s gender identity"
