75,75,75,35d559779b0b9849bd394864a13c14eaa845f877,"Random Darknet Shopper is a computer bot that randomly purchases an item every week from a hidden part of the internet called the dark net .
Swiss police seized bot after it purchased 10 ecstasy tablets from Germany .
It was later released 'without charge' according to the artists behind the bot .
They designed it as part of an art exhibition to display items bought by the robot over the dark net including trainers, a passport scan and cigarettes .",A robot has been arrested by Swiss police after it bought a supply of illegal drugs on a hidden region of the internet known as the dark net . The automated computer program was designed as an online shopping system that would spend up to USD100 each week by randomly purchasing an item offered for sale on the deep web. The robot would then have its purchase mailed to a group of artists who then put the items in an exhibition in the town of St Gallen in north east Switzerland. The Random Darknet Shopper purchased a number of items for sale on the deep web pictured including trainers jeans cigarettes a set of masterkeys and a DVD case far left containing 10 ecstasy tablets . The items it bought included a pair of Nike trainers counterfeit designer jeans the scan of a Hungarian passport and a set of UK Fire Brigade masterkeys. However it seems the Random Darknet Shopper crossed the line when it purchased 10 Ecstasy tablets which arrived in a vacuum packed bag hidden in a DVD case. The dark net is a subsection of the deep web the part of the internet that does not show up in searches or on social media. Most of the information on the web is far down on dynamically generated sites unable to be found or seen by traditional search engines which are rather like dragging a net across the surface of the sea missing much of the information in the depths. The dark net is used as a way of sharing information and trading goods but the anonymous and encrypted nature of it has attracted large amounts of illegal activity. The Silk Road website and its successor that were recently shut down was used to sell drugs in exchange for bitcoins the electronic currency. Other dark net sites allow users to share pornographic photographs hacked information credit card numbers and other illegal goods. The Silk Road used an underground computer network known as the The Onion Router TOR which is a matrix of encrypted websites and servers that disguise the identity of users. It uses numerous layers of security and encryption hiding the IP address and the activity of the user. Just 0.26 per cent of the daily internet traffic from the UK accesses this hidden part of the internet. Police seized the drugs the computer and the rest of the items it had purchased. Tests on the tablets later revealed they contained 90mg of the class A drug MDMA which the police then destroyed. The computer and the empty bag the ecstasy came in have now been returned to the group behind the bot !Mediengruppe Bitnik along with the other items it bought. They described the police s actions as an unjustified intervention into the freedom of art . Writing on their blog London based artists Carmen Weisskopf and Domagoj Smoljo who were behind the project said Random Darknet Shopper has finally been released and is now back in our possession. At the same time we also received the order for withdrawal of prosecution. In the order for withdrawal of prosecution the public prosecutor states that the possession of Ecstasy was indeed a reasonable means for the purpose of sparking public debate about questions related to the exhibition. The public prosecution also asserts that the overweighing interest in the questions raised by the art work Random Darknet Shopper justify the exhibition of the drugs as artefacts even if the exhibition does hold a small risk of endangerment of third parties through the drugs exhibited. We as well as the Random Darknet Shopper have been cleared of all charges. This is a great day for the bot for us and for freedom of art! The Random Darknet Shopper project was set up as an attempt to highlight some of the dilemmas that can be thrown up by dark net markets and anonymous internet use. It used Bitcoin to randomly purchase items that were offered for sail in the darknet. The tablets pictured above were sent from Germany inside a DVD case and a vacuum sealed foil bag . They were delivered to the artists by mail and then put on display in an exhibition at the Kunst Halle in St Gallen. During the weeks it had been running it also purchased a fake Louis Vuitton handbag a baseball cap with a hidden camera and 200 Chesterfield cigarettes. The darknet market features more than 16 000 items that are sold in a way that allows the seller to remain anonymous. The ecstasy tablets were found to contain 90mg of MDMA and were destroyed by the Swiss authorities . It has become notorious as a place to buy illegal pornography drugs and weapons. The robot software bought the ecstasy in October. It was sent from Germany to Switzerland and apparently crossed the border hidden in a DVD case without being intercepted by the authorities. The drugs were allowed to remain on show in the exhibition until it ended in January. However the police raided the exhibition when it came to an end and seized the computer and its purchases on the grounds the drugs were an endangerment of third parties. Speaking to the Guardian Mr Smoljo said that they had been told although the computer had purchased the drugs itself they were the legal owners of the drugs as they had executed the code behind the software. The case has raised important questions about the use of automatic shopping bots and the use of the darknet. In the past the artists have used technology to intercept CCTV images and sent a package to Wikileaks founder Julian Assange. Mr Smoljo and Miss Weisskopf said The Random Darknet Shopper is a live Mail Art piece an exploration of the deep web via the goods traded there.,"A robot has been arrested by Swiss police after it bought a supply of illegal drugs on a hidden region of the internet known as the dark net .
The automated computer program was designed as an online shopping system that would spend up to USD100 each week by randomly purchasing an item offered for sale on the deep web.
The robot would then have its purchase mailed to a group of artists who then put the items in an exhibition in the town of St Gallen in north east Switzerland.
The Random Darknet Shopper purchased a number of items for sale on the deep web pictured including trainers jeans cigarettes a set of masterkeys and a DVD case far left containing 10 ecstasy tablets .
The items it bought included a pair of Nike trainers counterfeit designer jeans the scan of a Hungarian passport and a set of UK Fire Brigade masterkeys.",A robot has been arrested by Swiss police after it bought a supply of illegal drugs on a hidden region of the internet known as the dark net . The items it bought included a pair of Nike trainers counterfeit designer jeans the scan of a Hungarian passport and a set of UK Fire Brigade masterkeys. The Silk Road website and its successor that were recently shut down was used to sell drugs in exchange for bitcoins the electronic currency. Just 0.26 per cent of the daily internet traffic from the UK accesses this hidden part of the internet. The computer and the empty bag the ecstasy came in have now been returned to the group behind the bot ! This is a great day for the bot for us and for freedom of art! They were delivered to the artists by mail and then put on display in an exhibition at the Kunst Halle in St Gallen. The darknet market features more than 16 000 items that are sold in a way that allows the seller to remain anonymous. However the police raided the exhibition when it came to an end and seized the computer and its purchases on the grounds the drugs were an endangerment of third parties.,automated computer program was designed as an online shopping system .nit would randomly purchase items offered for sale on the deep web .nitems included a pair of trainers jeans cigarettes and a set of masterkeys .nbut it seems the robot crossed the line when it purchased 10 ecstasy tablets .nthe dark net is a subsection of the internet that does not show up in searches or on social media .,"A robot programmed to randomly purchase items offered for sale on the dark net has been arrested by Swiss police after it bought a supply of illegal drugs. The Random Darknet Shopper was designed to spend up to USD100 a week on items for artists to exhibit in Switzerland. However, its purchase of ten ecstasy tablets caused its creators, !Mediengruppe Bitnik, some anxiety. Although police seized the computer and destroyed the drugs, the group has now had all charges dropped, with the public prosecutor accepting that the purchase of ecstasy was a means of public debate about questions related to the exhibition.","A robot, known as the Random Darknet Shopper, was arrested by Swiss police after purchasing illegal drugs along with other items like counterfeit jeans and Hungarian passport scans from the dark net, using Bitcoin. Designed by artists Carmen Weisskopf and Domagoj Smoljo, the bot was part of an art project to explore the deep web and the ethical questions surrounding dark net markets. The items, including 10 ecstasy tablets hidden in a DVD case from Germany, were displayed in an exhibition in St Gallen, Switzerland. The project aimed to highlight the dilemmas of dark net markets and anonymous internet use. After the exhibition ended, police seized the computer and drugs, but the artists were cleared of all charges, asserting the action as an expression of art freedom. The public prosecutor recognized the exhibition's intent to spark public debate on relevant issues, allowing the drugs to be displayed as artefacts despite potential risks. The incident raises significant questions about the use of automated shopping bots and darknet anonymity.",the robot bought 10 ecstasy tablets on the deep web in switzerland. it was bought by a group of artists who then put the items in an exhibition. the dark net is used as a way of sharing information and trading goods. police seized the drugs the computer and the rest of the items it bought.,Swiss police have arrested a robot after it purchased illegal drugs on the dark net. The robot was designed to randomly purchase an item offered for sale on the deep web and have it mailed to a group of artists who then put the items in an exhibition in Switzerland. The robot purchased a number of items,"```
A robot has been arrested by Swiss police after it bought a supply of illegal drugs on a hidden region of the internet known as the dark net.
The automated computer program was designed as an online shopping system that would spend up to USD100 each week by randomly purchasing an item offered for sale on"
76,76,76,b91e6223fb91f7a29fcc925a7a04ef72075eaab2,"Highest-earning NHS dentists earn almost five times more than Prime Minister’s £142,500 pay packet .
A further 11 dentists were paid between £400,000 and £500,000 a year .
Lay bare huge amounts of taxpayer money paid to dentists for NHS work .
Campaigners branded the payments were ‘scandalous’ and ‘unacceptable’",Britain s five highest earning NHS dentists are paid average salaries of GBP690 000 a year. The sum is almost five times the Prime Minister’s GBP142 500 pay packet – and comes as thousands of patients struggle to get on the books of NHS practices. A further 11 dentists were paid between GBP400 000 and GBP500 000 and a total of 177 received more than GBP200 000. More than 1 600 pocketed GBP100 000 GBP200 000. The figures lay bare the huge amounts of taxpayers’ money paid to dentists for NHS work following Labour’s introduction of controversial contracts in 2006. Scroll down for video . Lucrative Some dentists earn from multiple NHS contracts as well as private patients . Campaigners said the payments were ‘scandalous’ and ‘unacceptable’. Under freedom of information laws the NHS Business Services Authority was asked about the pensionable pay of dentists who do NHS work. In 2012/13 the latest figures available five practitioners were paid more than GBP500 000. They shared a total of about GBP3.4million – an average of GBP690 000. This comes on top of any money they take from treating patients privately. Another 11 earned GBP400 000 to GBP499 999 from the NHS 30 received GBP300 000 to GBP399 999 131 pocketed GBP200 000 to GBP299 999 and 1 617 received GBP100 000 to GBP199 999. Katherine Murphy of the Patients Association said the rates of pay were ‘exorbitant’. Yesterday s Daily Mail . She added ‘Investment is urgently needed on the front line where there is a desperate shortage of nurses and patients waiting for hours in A&E ... when the NHS is under such huge financial pressure this type of spending on huge salaries is unacceptable.’ It follows revelations in Thursday’s Mail that millions of pounds was being wasted on NHS prescriptions for suncream and toothpaste. Yesterday the Mail also exposed a GBP2 700 charge for cataract surgery at some hospitals – treble the cost to the health service – raising suspicions that patients are being ripped off. Patient Concern’s Roger Goss said ‘This is scandalous. People will be shocked to hear the sums lining dentists’ pockets when it is almost impossible to find dental care on the NHS in some parts of the country. ‘There is something strange going on when the NHS will pay for gastric bands suncream and hangover tablets yet it is so difficult to get dental treatment on it. It is almost perverse.’ Jonathan Isaby of the Taxpayers Alliance which the Mail commissioned to carry out the research said the salaries show a ‘shameless public sector elite taking taxpayers for a ride’. He added ‘It is outrageous that these telephone number salaries have been hidden from the people who pay them ... Taxpayers expect the money they put in to the NHS to be spent on patients not on bumper pay packets.’ The contracts brought in by Labour were designed to improve access to NHS dentistry. But patients are still struggling to get an appointment. The pay deals gave practitioners a fixed sum for a set amount of work agreed at the start of the year rather than separate incomes for the number of patients treated or procedures done. Thursday s Daily Mail . Treatments are divided into three bands from a simple check up earning the dentist GBP25 to procedures such as fitting dentures and crowns for roughly GBP300. The value of a contract can run to millions of pounds and some dentists run more than one practice so hold multiple contracts. According to the Health and Social Care Information Centre 21 500 dentists did NHS work in 2012/13 but most also do substantial amounts of private work. The British Dental Association’s Mick Armstrong said the top earning dentists ‘most likely own a group of practices’ or are specialists in their area. But Tory Charlotte Leslie who sat on the health select committee of MPs said ‘Most people will be absolutely stunned individual clinicians are getting such astronomical salaries on the NHS.’ A spokesman for NHS England said it contracts the vast majority of dental services from self employed individuals or companies some of whom ‘earn income from a number of contracts’.,"Britain s five highest earning NHS dentists are paid average salaries of GBP690 000 a year.
The sum is almost five times the Prime Minister’s GBP142 500 pay packet – and comes as thousands of patients struggle to get on the books of NHS practices.
A further 11 dentists were paid between GBP400 000 and GBP500 000 and a total of 177 received more than GBP200 000.
More than 1 600 pocketed GBP100 000 GBP200 000.
The figures lay bare the huge amounts of taxpayers’ money paid to dentists for NHS work following Labour’s introduction of controversial contracts in 2006.",Britain s five highest earning NHS dentists are paid average salaries of GBP690 000 a year. The sum is almost five times the Prime Minister’s GBP142 500 pay packet – and comes as thousands of patients struggle to get on the books of NHS practices. Katherine Murphy of the Patients Association said the rates of pay were ‘exorbitant’. There is something strange going on when the NHS will pay for gastric bands suncream and hangover tablets yet it is so difficult to get dental treatment on it. But patients are still struggling to get an appointment. Treatments are divided into three bands from a simple check up earning the dentist GBP25 to procedures such as fitting dentures and crowns for roughly GBP300.,a further 11 dentists were paid between GBP400 000 and GBP500 000 .nmore than 1 600 pocketed more than GBP200 000 and 177 received more .ncampaigners said payments were 'scandalous' and 'unacceptable',"Five of the highest earning dentists in the NHS are paid an average salary of £690,000 per year, almost five times the Prime Minister’s pay. The figures were obtained through freedom of information laws, which revealed that 11 dentists were paid between £400,000 and £500,000 and 177 received over £200,000. The payments for NHS work have been described as “scandalous” and “unacceptable” at a time when patients struggle to access NHS dental practices. The contracts, introduced in 2006, gave practitioners a fixed sum for a set amount of work agreed at the start of the year rather than separate incomes for the number of patients treated or procedures done.","Britain's five highest-earning NHS dentists receive average salaries of GBP690,000 a year, nearly five times the Prime Minister's salary, amid struggles for patients to find NHS dental care. The staggering pay figures revealed under freedom of information laws show that in addition to the top earners, 11 dentists earn between GBP400,000 and GBP500,000, and a total of 1,784 dentists earn over GBP100,000 from the NHS. These earnings come as the NHS faces financial pressure and a shortage of frontline services like nursing and emergency care. High dental salaries, part of NHS contracts introduced by Labour in 2006 to improve dental access, have been criticized amid ongoing difficulties for patients seeking NHS dental appointments and accusations of extensive spending on non-essential NHS prescriptions. The British Dental Association suggests that the top earners likely own multiple practices or are specialists, while NHS England explains that it contracts dental services from self-employed individuals or companies, some of whom hold multiple NHS contracts. Critics, including patient advocacy groups and the Taxpayers Alliance, have called the high dental payments scandalous and a misuse of taxpayer funds intended for patient care.",the sum is almost five times the prime minister ’ s gbp142 500 pay packet. more than 1 600 pocketed gbp100 000 and a total of 177 received more than gbp200. another 11 dentists were paid between gbp400 000 and gbp500 000. campaigners said the payments were ‘ scandalous ’ and ‘ unacceptable ’,"Britain's top five highest earning NHS dentists are paid an average salary of £690,000 per year, which is almost five times the Prime Minister's salary. A further 11 dentists were paid between £400,000 and £500,000, and a total of 177 received more","```
Britain s five highest earning NHS dentists are paid average salaries of GBP690 000 a year.
A further 11 dentists were paid between GBP400 000 and GBP500 000 and a total of 177 received more than GBP200 000.
The figures lay bare the huge"
