52,52,52,2d8090d6e313140c83b04d80d450866584f725ee,"Ex deputy PM said there was no problem with Charles writing to ministers .
Admitted Charles had sent him a lot of letters while he was in government .
Released two, including one condolence letter over death of his mother .
Comes after court ruled Charles's letters to ministers should be published .",Labour peer John Prescott has defended Prince Charles over allegations he tries to secretly influence government policy with scrawled private notes to ministers insisting he should right to write as many damn letters as he likes . The former deputy prime minister said he cannot see a problem with the future King writing to government ministers and insisted he had a lot to offer this country . Lord Prescott s intervention comes after the Supreme Court backed a previous ruling paving the way for the publication of Prince Charles s so called black spider memos. Lord Prescott left said that the Prince of Wales has a lot to offer the country . The letters were penned between September 2004 and March 2005 and sent by the Prince to seven government departments. Lord Prescott whose letters are separate to those due to be released said that while he is not a raving loyalist he has a lot of time for Charles who he described as a passionate environmentalist. He said while he listens to the views of everyone who contacts him on political matters he makes his own decisions. The former Labour minister writing in the Sunday Mirror said Charles has an awful lot to offer this country. And if he wants to serve his subjects by helping young people into work combating climate change and building sustainable communities he can write as many damn letters as he likes. Lord Prescott published extracts from two letters he received from the Prince including one expressing his sadness at the death of the Labour politician s mother. The Labour peer said the notes proved the measure of the man . He said They show he has nothing to hide and he should not be worried about publication. The first letter is a typed ­invitation to a meeting of Regional­ ­Development Agency leaders in 1999. Charles says it would be splendid to see Lord Prescott. The second is more personal and was written in the Prince s ­distinctive handwriting in 2003. It expresses sadness at the death of Lord Prescott s mother. The Prince opens by joking that he has been overdoing the quota of letters to the Deputy PM. Prince Charles with the Duchess of Cornwall at Ascot races last week does a lot of good for the country according to the former Labour minister Lord Prescott . But despite this – and the trouble the press would give him – he goes on to express his sadness and says his heart goes out to the politician. He added I did receive letters from the prince when I was in government but they had no effect on any policy. People say he should not be writing to ministers but he s quite entitled to express his opinion. Politicians are lobbied all the time by individuals and groups and none of them would allow a letter – even from Prince Charles – to unduly ­influence them. Prince Charles has long been accused of bombarding ministers with black spider memos attacking government policy. His letters are so named after his distinctive handwriting and abundant use of underlining and exclamation marks. Both Clarence House and the Prime Minister expressed disappointment after the court ruling. The notes reflect according to previous attorney general Dominic Grieve the prince s most deeply held personal views and beliefs .,"Labour peer John Prescott has defended Prince Charles over allegations he tries to secretly influence government policy with scrawled private notes to ministers insisting he should right to write as many damn letters as he likes .
The former deputy prime minister said he cannot see a problem with the future King writing to government ministers and insisted he had a lot to offer this country .
Lord Prescott s intervention comes after the Supreme Court backed a previous ruling paving the way for the publication of Prince Charles s so called black spider memos.
Lord Prescott left said that the Prince of Wales has a lot to offer the country .
The letters were penned between September 2004 and March 2005 and sent by the Prince to seven government departments.",Labour peer John Prescott has defended Prince Charles over allegations he tries to secretly influence government policy with scrawled private notes to ministers insisting he should right to write as many damn letters as he likes . The former deputy prime minister said he cannot see a problem with the future King writing to government ministers and insisted he had a lot to offer this country . Lord Prescott published extracts from two letters he received from the Prince including one expressing his sadness at the death of the Labour politician s mother. The second is more personal and was written in the Prince s ­distinctive handwriting in 2003. The Prince opens by joking that he has been overdoing the quota of letters to the Deputy PM. Both Clarence House and the Prime Minister expressed disappointment after the court ruling.,the former deputy prime minister said he cannot see a problem with the future King writing to government ministers .nthe notes were penned between September 2004 and March 2005 and sent by the prince to seven government departments .nhe said while he listens to the views of everyone who contacts him he makes his own decisions .,"Former deputy prime minister, John Prescott, has defended Prince Charles over the allegations that he secretly influenced government policy by writing private notes to ministers. Prescott said that he cannot see any problem with the Prince of Wales writing to government ministers and insists that he had a lot to offer the country. The Supreme Court backed a previous ruling to publish Prince Charles’s black spider memos, which were penned between September 2004 and March 2005 and sent to seven government departments. Prescott said that Prince Charles has a lot to offer the country, particularly in the areas of young people, combating climate change, and building sustainable communities.","Labour peer John Prescott has defended Prince Charles against allegations that he inappropriately attempts to influence government policy through private notes to ministers, arguing that the Prince should have the freedom to write as he pleases. Prescott asserts that Prince Charles, with his passionate environmentalism and desire to address social issues, has much to contribute to the nation. This defense comes in the wake of a Supreme Court decision which allows the publication of Charles's so-called ""black spider memos,"" penned between September 2004 and March 2005 to various government departments. Despite criticism, Prescott, who has received personal letters from Charles, maintains these communications have no undue influence on policy decisions. He believes that Charles's proactive engagement, even through personal letters, underlines his commitment to public service and should not be a subject of concern. Clarence House and the Prime Minister have expressed disappointment over the court's decision to make the letters public, which are said to reveal the Prince's deeply held views.",former deputy prime minister said he cannot see a problem with the future king writing to ministers. lord prescott said the prince of wales has a lot to offer the country. the former labour minister said the letters proved the measure of the man. he said while he listens to the views of everyone contacts him on political matters he makes his own decisions.,Labour peer John Prescott has defended Prince Charles over allegations he tries to secretly influence government policy with scrawled private notes to ministers insisting he should right to write as many damn letters as he likes. Lord Prescott's intervention comes after the Supreme Court backed a previous ruling paving the way for the publication of Prince,"```
Labour peer John Prescott has defended Prince Charles over allegations he tries to secretly influence government policy with scrawled private notes to ministers insisting he should right to write as many damn letters as he likes.
Lord Prescott s intervention comes after the Supreme Court backed a previous ruling paving the way for the publication"
53,53,53,80776790599b34cc1a3ac5f7a28a3f5a26ef4d78,"Zimbabwe have reportedly agreed to visit Pakistan for ODI series in May .
Pakistan have not played host to major cricket series since 2009 .
There have been security fears since Sri Lanka were victims of terror attack .
Team bus was targeted by gunmen in Lahore, and eight people were killed .",Pakistan appear set to host Test playing opposition in their home country for the first time in more than six years. Zimbabwe have reportedly agreed to travel for a short one day international series next month likely to take place in Lahore and Karachi. No tourists have played in Pakistan because of security fears since the terrorist attack on Sri Lanka s team bus in Lahore in March 2009 when six policemen and two civilians died and several of the tourists were injured. A policeman weeps over the covered body of one of his colleagues killed when gunmen attacked the Sri Lankan cricket team in March 2009. Their team bus came under fire while travelling through the city of Lahore . Sri Lankan cricketers were rescued by the Pakistani air force from Gadaffi Stadium after the terror attack . Security officials display arms and ammunition seized after the terrorists attack on the Sri Lanka team . Home Test and ODI series in the meantime have taken place in the United Arab Emirates England s destination for the second time this autumn a tour for which an exact schedule is still to be confirmed. The details of Zimbabwe s proposed trip are also not yet known. But Pakistan Cricket Board president Shaharyar Khan has stated that after discussions with his Zimbabwean opposite number Wilson Manase he expects the short tour to go ahead. Pakistan s Misbah ul Haq left and Wahab Riaz look set to play international cricket in their homeland again . Shaharyar said He Manase told me they are coming and they are coming with their full team but just for a week. They will send a security team to assess the situation following which they will confirm the tour. So they will come in the middle of May and our efforts will be to host matches in Lahore and Karachi.,"Pakistan appear set to host Test playing opposition in their home country for the first time in more than six years.
Zimbabwe have reportedly agreed to travel for a short one day international series next month likely to take place in Lahore and Karachi.
No tourists have played in Pakistan because of security fears since the terrorist attack on Sri Lanka s team bus in Lahore in March 2009 when six policemen and two civilians died and several of the tourists were injured.
A policeman weeps over the covered body of one of his colleagues killed when gunmen attacked the Sri Lankan cricket team in March 2009.
Their team bus came under fire while travelling through the city of Lahore .",Pakistan appear set to host Test playing opposition in their home country for the first time in more than six years. Home Test and ODI series in the meantime have taken place in the United Arab Emirates England s destination for the second time this autumn a tour for which an exact schedule is still to be confirmed. They will send a security team to assess the situation following which they will confirm the tour.,no tourists have played in the country since the terrorist attack on a team bus in lahore in 2009 .nsix policemen and two civilians died and several of the tourists were injured .na security team will assess the situation following which they will confirm the tour .,"Zimbabwe has reportedly agreed to play a short one-day international series in Pakistan next month, which would mark the first time a Test playing team has visited the country in over six years due to security fears. The proposed tour, likely to take place in Lahore and Karachi, is still subject to confirmation following an assessment by a security team from Zimbabwe, but Pakistan Cricket Board president, Shaharyar Khan, has expressed confidence that it will go ahead. Home Test and ODI series for Pakistan have taken place in the UAE since the terror attack on the Sri Lankan team in Lahore in March 2009.","For the first time in over six years, Pakistan is poised to host Test playing opposition on their home soil, with Zimbabwe reportedly agreeing to a short one-day international series next month, likely in Lahore and Karachi. This comes after no international cricket tours in Pakistan due to security concerns following the 2009 terrorist attack on the Sri Lankan team bus in Lahore, which resulted in the death of six policemen, two civilians, and injuries to several players. Since then, Pakistan's home Test and ODI series have been held in the United Arab Emirates. Pakistan Cricket Board president Shaharyar Khan has expressed optimism that the tour will proceed after discussions with Zimbabwe Cricket's Wilson Manase, who confirmed their team's visit but mentioned that a security team would assess the situation before finalizing the tour, aiming for matches in Lahore and Karachi in mid-May.",pakistan have agreed to travel for a short one day international series next month. no tourists have played in pakistan because of security fears since the terrorist attack on sri lanka team bus in march 2009 when six policemen and two civilians died. pakistan cricket board president shaharyar khan has stated that pakistan's misbah ul haq left and wahab riaz look set to play international cricket again.,"Zimbabwe have agreed to play a short one day international series in Pakistan next month, which would be the first time in over six years that Test playing opposition has visited the country. No tourists have played in Pakistan since the terrorist attack on Sri Lanka's team bus in Lahore in March 2009.","```
Pakistan appear set to host Test playing opposition in their home country for the first time in more than six years.
Zimbabwe have reportedly agreed to travel for a short one day international series next month likely to take place in Lahore and Karachi.
No tourists have played in Pakistan because of security fears since"
54,54,54,56a5d6ac931556143bb0e4069121d98728910b76,"Fifty top fashionistas all posted photos of the same Lord & Taylor dress on Instagram at the weekend .
The retailer has admitted that the bloggers got 'unspecified compensation' to lend their credability and give the dress their seal of approval .
The ploy proved an instant success as the $88 Paisley Asymmetrical Dress sold out and created an online buzz for the entire Design Lab collection .
The deal highlights the gray area of bloggers failing to disclose when they've received payment for promoting some goods and services .",Fashion fans who follow many of the top bloggers on Instagram experienced an extreme case of deja vu over the weekend after the same dress was modeled by no less than 50 fashionistas. The highly usual situation was no coincidence but rather a clever marketing ploy dreamed up by retailer Lord & Taylor to promote its edgy new fashion forward range. In order to ensure maximum exposure for their new Design Lab collection the company partnered with 50 of the most influential fashion bloggers and got each to post a photo of them wearing the same dress. Scroll down for video . Fashion fans who follow many of the top bloggers on Instagram experienced an extreme case of deja vu over the weekend after the same dress was modelled by no less than 50 fashionistas . The highly usual situation was no coincidence but rather a clever marketing ploy dreamed up by retailer Lord & Taylor to promote its edgy new fashion forward range . The move proved an instant success as the USD88 Paisley Asymmetrical Dress sold out almost immediately and created an online buzz for the range. To convince that many fashionistas including Caitlin Lindquist and Rachel Lynch to promote your new line is extremely rare but Lord & Taylor didn’t leave anything to chance and the company has admitted that it paid the bloggers to wear the paisley print handkerchief hem summer dress. Adweek reports that the bloggers received ‘unspecified compensation’ in return for giving the dress their seal of approval. ‘The goal was to make the potential customer stop in her feed and ask why all her favorite bloggers are wearing this dress and what is Design Lab Using Instagram as that vehicle is a logical choice especially when it comes to fashion ’ said Lord & Taylor s CMO Michael Crotty. Many of the posts generated more than 1 000 Likes each with several surpassing 5 000 Likes and some reaching rarified levels like 13 000 Likes. Significantly none of the bloggers were transparant on their Instagram feeds about the fact that Lord & Taylor had paid them to promote the dress. The move proved an instant success as the USD88 Paisley Asymmetrical Dress sold out almost immediately and created an online buzz for the range . In order to ensure maximum exposure for their new Design Lab collection the company partnered with 50 of the most influential fashion bloggers and got each to post a photo of them wearing the same dress . The Lord & Taylor deal highlights the gray area of bloggers receiving payment for promoting some goods and services while others they lend their credability to for free. While newspapers and websites such as the Daily Mail Online have to be upfront and clearly state when something is paid for content the rules are less stringent on social media. Many celebrities now promote products and luxury brands via Twitter in return for either payment or freebies. Rap star Snoop Dogg and actress Lindsay Lohan are among the famous names who have been paid by big businesses to promote products to their massive Twitter followings. In leaked Sony emails in December it was revealed that comedian Kevin Hart had been paid USD2 million to send out tweets to his 14.8 million followers promoting The Equalizer starring Denzel Washington and the Idris Elba film No Good Deed. Make sure yo go support my Brother this weekend by seeing No Good Deed .... & Idris kill this movie! wrote the actor on September 12. To convince that many fashionistas to promote your new line is extremely rare but Lord & Taylor didn’t leave anything to chance and the company has admitted it paid the bloggers to wear the paisley print handkerchief hem summer dress . Significantly none of the bloggers were transparant on their Instagram feeds about the fact that Lord & Taylor had paid them to promote the dress .,"Fashion fans who follow many of the top bloggers on Instagram experienced an extreme case of deja vu over the weekend after the same dress was modeled by no less than 50 fashionistas.
The highly usual situation was no coincidence but rather a clever marketing ploy dreamed up by retailer Lord & Taylor to promote its edgy new fashion forward range.
In order to ensure maximum exposure for their new Design Lab collection the company partnered with 50 of the most influential fashion bloggers and got each to post a photo of them wearing the same dress.
Scroll down for video .
Fashion fans who follow many of the top bloggers on Instagram experienced an extreme case of deja vu over the weekend after the same dress was modelled by no less than 50 fashionistas .",Fashion fans who follow many of the top bloggers on Instagram experienced an extreme case of deja vu over the weekend after the same dress was modeled by no less than 50 fashionistas. In order to ensure maximum exposure for their new Design Lab collection the company partnered with 50 of the most influential fashion bloggers and got each to post a photo of them wearing the same dress. The move proved an instant success as the USD88 Paisley Asymmetrical Dress sold out almost immediately and created an online buzz for the range. To convince that many fashionistas including Caitlin Lindquist and Rachel Lynch to promote your new line is extremely rare but Lord & Taylor didn’t leave anything to chance and the company has admitted that it paid the bloggers to wear the paisley print handkerchief hem summer dress. Significantly none of the bloggers were transparant on their Instagram feeds about the fact that Lord & Taylor had paid them to promote the dress.,fashion fans who follow many of the top bloggers on Instagram experienced an extreme case of deja vu over the weekend after the same dress was modeled by no less than 50 fashionistas .nthe highly usual situation was no coincidence but rather a clever marketing ploy dreamed up by retailer Lord & Taylor to promote its edgy new fashion forward range .,"Retailer Lord & Taylor partnered with 50 influential fashion bloggers to promote its new Design Lab collection by having them all wear the same dress and post photos on Instagram. The USD88 dress, which sold out almost immediately, generated a buzz on social media, with some posts receiving more than 13,000 likes. Lord & Taylor admitted that it paid the bloggers for their service, which is not uncommon in the world of celebrity endorsements. However, a lack of transparency from the bloggers about being paid for their posts highlights the grey area of paid content on social media.","Over the weekend, a significant number of fashion fans experienced déjà vu when they noticed 50 influential fashion bloggers on Instagram all modeling the same dress, a marketing strategy devised by retailer Lord & Taylor for its new Design Lab collection. This clever ploy utilized the reach of popular bloggers to ensure maximum exposure for the USD88 Paisley Asymmetrical Dress, which quickly sold out and generated significant online buzz. Lord & Taylor partnered with these bloggers, including notable names like Caitlin Lindquist and Rachel Lynch, paying them an unspecified compensation for their endorsements. Despite the campaign's success and the interest it stirred among potential customers, the transparency of this paid promotion was questioned, as none of the bloggers disclosed the financial arrangement with Lord & Taylor on their Instagram feeds. This incident highlights the broader issues of undisclosed paid promotions on social media platforms, contrasting with more stringent disclosure requirements in traditional media.",fashion fans who follow many of the top bloggers on instagram experienced an extreme case of deja vu over the weekend. the usd88 paisley asymmetrical dress sold out almost immediately and created an online buzz for the range. but the company admitted that it paid the bloggers to wear the paisley print handkerchief hem summer dress.,"Retailer Lord & Taylor partnered with 50 influential fashion bloggers to promote its new Design Lab collection by having each of them post a photo of themselves wearing the same dress on Instagram. The bloggers were paid an unspecified amount to promote the $88 Paisley Asymmetrical Dress, which sold out almost immediately","```
Fashion fans who follow many of the top bloggers on Instagram experienced an extreme case of deja vu over the weekend after the same dress was modeled by no less than 50 fashionistas.
The highly usual situation was no coincidence but rather a clever marketing ploy dreamed up by retailer Lord & Taylor to"
