25,25,25,2456eb006797ddc4afc4e0533113c9167fbb24c7,"Farage claims PM has been secretly using hair dye to turn back the years .
He said: 'Any man who can reverse the greying process I’m jealous of'
The PM has been accused of visiting stylists to keep hair looking youthful .",David Cameron has been secretly using hair dye to turn back the years Nigel Farage suggested today. In a dig at the Prime Minister the Ukip leader said that he was ‘jealous’ of how the Tory leader has reversed the greying process while in Downing Street. After clashing at last week’s televised leaders debate Mr Farage said he had shaken Mr Cameron’s hand and ‘complimented him on his appearance’. Scroll down for video . David Cameron who has been accused of trying to hide his bald spot has been secretly using hair dye to turn back the years Nigel Farage suggested today . He added ‘Any man who can reverse the greying process I’m jealous of. ‘I’m going to have a go myself it’s a wonderful thing. He’s also lost a lot of weight he’s going out jogging.’ Asked if he thought Mr Cameron was too vain Mr Farage said ‘To a certain extent they all are. Some people it worries to death and others really don’t worry too much.’ Mr Cameron 48 has previously been accused of visiting stylists and even trichologists to keep his hair looking youthful. In 2011 Downing Street was forced to deny claims Mr Cameron was fighting the relentless process with unnatural help after his grey hairs looked less prominent . ‘I promise you he has not dyed his hair ’ a spokesman said. ‘The Prime Minister has other things to think about he’s just not like that.’ Mr Farage said he was ‘jealous’ of how the Tory leader has reversed the greying process while in Downing Street . Asked if he thought Mr Cameron was too vain a greying Mr Farage said ‘To a certain extent they all are. Some people it worries to death and others really don’t worry too much Before he was elected Mr Cameron the youngest premier in almost 200 years revealed he was concerned about going grey. I have had a few grey hairs and I expect I will get a few more whatever happens. This is a relentless process he said. A Tory party spokesman last night refused to comment on whether Mr Cameron dyes his hair.,"David Cameron has been secretly using hair dye to turn back the years Nigel Farage suggested today.
In a dig at the Prime Minister the Ukip leader said that he was ‘jealous’ of how the Tory leader has reversed the greying process while in Downing Street.
After clashing at last week’s televised leaders debate Mr Farage said he had shaken Mr Cameron’s hand and ‘complimented him on his appearance’.
Scroll down for video .
David Cameron who has been accused of trying to hide his bald spot has been secretly using hair dye to turn back the years Nigel Farage suggested today .",David Cameron has been secretly using hair dye to turn back the years Nigel Farage suggested today. In a dig at the Prime Minister the Ukip leader said that he was ‘jealous’ of how the Tory leader has reversed the greying process while in Downing Street. David Cameron who has been accused of trying to hide his bald spot has been secretly using hair dye to turn back the years Nigel Farage suggested today . I have had a few grey hairs and I expect I will get a few more whatever happens.,in a dig at the prime minister he said that he was ‘jealous’ of how the Tory leader has reversed the greying process while in Downing Street .nhe added he had shaken Mr Cameron’s hand and ‘complimented him on his appearance’ .,"The leader of UKIP, Nigel Farage, has suggested that David Cameron is using hair dye to reverse the greying process. This comes after a clash during the TV leaders debate, where Farage had complimented Cameron on his appearance. In the past, Cameron has been accused of visiting stylists and trichologists to keep his hair looking youthful. However, Downing Street denied these claims and stated that Cameron ""has other things to think about"". Farage commented that he was ""jealous"" of Cameron's ability to reverse the greying process and stated that ""to a certain extent they all are"" vain. The Tory party refused to comment on the allegations.","Nigel Farage suggested that David Cameron has been secretly using hair dye to look younger, expressing jealousy over the Prime Minister's ability to reverse the greying process. Farage noted his own desire to attempt reversing his greying, mentioning Cameron's weight loss and jogging routine. Despite previous accusations and denials from Downing Street regarding Cameron's hair treatment, this issue has reignited speculation. Farage commented on the vanity common among politicians, reflecting on how some are greatly concerned by their appearance while others are not. Cameron, previously worried about greying, faces continued speculation, with a Tory party spokesman declining to comment on the hair dye allegations.",nigel farage said he was ‘ jealous ’ of how the tory leader has reversed the greying process while in downing street. he said he had shaken mr cameron ’ s hand and ‘ complimented him on his appearance ’ in a dig at the prime minister the ukip leader said that he was'jealous'of how mr cameron's grey hairs looked less prominent.,"David Cameron has been accused of using hair dye to reverse the greying process by Nigel Farage. The Ukip leader said he was ""jealous"" of the Prime Minister's appearance. Cameron has previously been accused of visiting stylists and trichologists to keep his hair looking youthful. Downing Street denied","David Cameron has been secretly using hair dye to turn back the years Nigel Farage suggested today.
David Cameron who has been accused of trying to hide his bald spot has been secretly using hair dye to turn back the years Nigel Farage suggested today.
‘I promise you he has not dyed his hair,’ a"
27,27,27,0e28a2e66c7fdbb795e067a8f4207ace4d186715,"David Messerschmitt, 30, who met his wife in college, had been using Craigslist to solicit men, according to an affidavit on Tuesday .
Jamyra Gallmon, 21, 'contacted victim using a masculine-sounding email address and went to hotel with the intention of robbing him'
The pair got into a struggle on February 9 and she stabbed him repeatedly in the abdomen, back and groin .
The lawyer was found dead at the upscale Washington DC hotel after being reported missing by his wife .
Gallmon made an initial appearance on the murder charge Superior Court in DC on Thursday .",A newlywed husband who was stabbed to death in a hotel room had solicited his murderer during a Craigslist exchange for gay sex according to new court records on Thursday. Jamyra Gallmon 21 has been charged with first degree murder while armed for allegedly killing David Messerschmitt 30 on February 9 in Washington D.C. The woman admitted to police that she set up the lawyer using a masculine sounding email address and went to the upscale Donovan hotel with the intention of robbing him. Scroll down for video . Jamyra Gallmon 21 pictured graduating from her military academy high school has been charged with first degree felony murder while armed for allegedly stabbing to death 30 year old David Messerschmitt on February 9 . David Messerschmitt pictured with his wife Kim was found dead in his DC hotel room in February. An affidavit revealed on Thursday that he had been soliciting sex from men through Craigslist . According to Gallmon who was seen on surveillance camera entering the hotel wearing androgynous clothing including black boots black pants and a black hooded jacket the room door was open when she arrived. The affidavit stated that the pair got into a struggle and the defendant pulled a knife from her pants and stabbed the victim repeatedly until he fell to the floor where she stabbed him several more times. The victim was found with multiple stab wounds to the back groin and abdomen along with one wound which pierced his heart and another which hit his spinal cord. His hands had been bound with zip ties into a pair of makeshift cuffs. His hands were covered in defensive wounds. Messerschmitt had texted his wife Kim Vuong at 7.45pm on February 9 to tell her he would be home in an hour after leaving his law office. He never returned and the next day he was found dead at his hotel room with various credit cards strewn about . He death was declared a homicide. Among the items recovered from the room were a computer lubricant condoms cell phone and enema kit Fox DC reported. Fingerprints were also found in the room. Investigators discovered that Messerschmitt had posted a Craigslist ad on February 9 soliciting responses from other men using dcguy456 . The lawyer began an exchange with an individual using the name chrissanchez0906 around 2pm which continued throughout the day. Messerschmitt told the individual his room number at the hotel and gave a meeting time of 7pm 7.30pm. The email address that the lawyer had been in contact with was linked to Gallmon. On a search of the woman s DC apartment police found a knife black boots and gloves and a pack of zip ties. A discussion in the comments section of a Queerty.com article about Mr Messerschmitt s murder in February included users referencing interactions with an individual using the handle dcguy456 . One commenter said that dcguy456 had previously posted on the M4M men for men section of Craigslist and identified himself as bisexual. Another individual s post claimed that he had exchanged emails with dcguy456 and met up with him several years ago. A woman has been arrested in connection to the murder of 30 year old Washington DC lawyer David Messerschmitt. Above the person of interest who was caught on surveillance video entering the hotel where Messerschmitt was killed on February 9. Police confirmed that this was Gallmon . Jamyra Gallmon attended Forestville Military Academy in Maryland and was an exemplary student a teacher said on Thursday. According to an affidavit it is believed that Mr Messerschmitt got her to come to his hotel room believing that he was soliciting a man . Gallmon made an initial appearance on the felony murder charge Superior Court in DC on Thursday. The 21 year old attended the Forestville Military Academy in Maryland a coach toldFox 5 on Thursday and had been an exemplary student. She graduated in 2011. Her mother told NBC that her daughter had never been in trouble before and had an ambition to join the military. Coach and teacher Vincent McDuffie told the station that she had wanted to play basketball in college but had suffered a knee injury. He said that her supportive family always turned up to watch her high school games. According to the police report Messerchmitt left his work at law film DLA Piper around 5.30pm on February 9 and texted his wife a couple of hours later to say he would back at their Capitol Hill home in an hour. The couple reportedly had not seen each other since February 8 but Vuong did not think anything seemed wrong with her husband. She reported him missing at midnight saying it was unlike him to disappear and that usually he got home before her. Messerschmitt was found dead in his room the next day and pronounced dead at the scene. Authorities have arrested a Washington DC woman named Jamyra Gallmon for the crime. On the left another view of the person of interest on CCTV and on the right Messerschmitt. Police sources told NBC Washington that the woman in the surveillance video is Gallmon . Messerschmitt texted his wife Kim Vuong on February 9 that he would be home in an hour but never showed. It appears he had gone to the Donovan hotel after arranging to have sex with an individual on Craigslist who he believed to be a man . Gallmon s mother said that her 21 year old daughter pictured had never been in trouble before and had an ambition to join the military. She told police she stabbed the lawyer multiple times according to an affidavit . Last week Messerchmitt s wife gave an emotional speech asking for help in finding her husband s killer. The world has lost a good person. David s family a son and brother and I have lost everything my husband and my best friend. In one day I lost the most important person in my life and the man I loved so much. And I have no answers she said. A Cincinnati native Messerchmitt attended Ohio State University where he met his wife. He went on to study law at Boston University before working at a firm in Chicago. He then worked at two more firms in the D.C. area before transferring to DLA Piper last year as a specialist in intellectual property law. Emotional Last week Messerschmitt s wife Kim Vuong held a press conference asking for help in locating her husband s killer . Gallmon told police she had gone to the Donovan hotel pictured with the intention of robbing Mr Messerchmitt. He was found stabbed to death in his hotel room on February 10 .,"A newlywed husband who was stabbed to death in a hotel room had solicited his murderer during a Craigslist exchange for gay sex according to new court records on Thursday.
Jamyra Gallmon 21 has been charged with first degree murder while armed for allegedly killing David Messerschmitt 30 on February 9 in Washington D.C.
The woman admitted to police that she set up the lawyer using a masculine sounding email address and went to the upscale Donovan hotel with the intention of robbing him.
Scroll down for video .
Jamyra Gallmon 21 pictured graduating from her military academy high school has been charged with first degree felony murder while armed for allegedly stabbing to death 30 year old David Messerschmitt on February 9 .",A newlywed husband who was stabbed to death in a hotel room had solicited his murderer during a Craigslist exchange for gay sex according to new court records on Thursday. Jamyra Gallmon 21 has been charged with first degree murder while armed for allegedly killing David Messerschmitt 30 on February 9 in Washington D.C. The woman admitted to police that she set up the lawyer using a masculine sounding email address and went to the upscale Donovan hotel with the intention of robbing him. David Messerschmitt pictured with his wife Kim was found dead in his DC hotel room in February. Fingerprints were also found in the room. The email address that the lawyer had been in contact with was linked to Gallmon. Jamyra Gallmon attended Forestville Military Academy in Maryland and was an exemplary student a teacher said on Thursday. Her mother told NBC that her daughter had never been in trouble before and had an ambition to join the military. Coach and teacher Vincent McDuffie told the station that she had wanted to play basketball in college but had suffered a knee injury. According to the police report Messerchmitt left his work at law film DLA Piper around 5.30pm on February 9 and texted his wife a couple of hours later to say he would back at their Capitol Hill home in an hour. She reported him missing at midnight saying it was unlike him to disappear and that usually he got home before her. In one day I lost the most important person in my life and the man I loved so much.,affidavit revealed that he had solicited sex from men through dcguy456 .nhe was found dead in his hotel room the next day and pronounced dead at the scene .npolice have arrested a woman named as jamyra Gallmon .,ERROR,ERROR,jamyra gallmon 21 has been charged with first degree murder while armed for allegedly stabbing to death david messerschmitt 30 on february 9. the woman admitted to police that she set up the lawyer using a masculine sounding email address and went to the upscale donovan hotel with the intention of robbing him. the victim was found with multiple stab wounds to the back groin and abdomen along with one wound which pierced his heart and another which hit his spinal cord. his hands were bound with zip ties into a pair of makeshift handcuffs.,ERROR,ERROR
30,30,30,7f53ab255bad30f06dccb9041db53f4b8f5ad29c,"Kevin Streelman beat Camilo Villegas on third play-off hole at Augusta .
Tiger Woods played in the par-three contest for the first time since 2004 .
Jack Nicklaus recorded his first ever hole-in-one at the Masters .",Jack Nicklaus recorded his first ever hole in one at the Masters on Wednesday as Camilo Villegas fired two in the space of five holes but still could not win the traditional par three contest. Villegas holed out on the fourth and eighth as he finished alongside Kevin Streelman on five under par only to find water on the eighth when he played it again as the third play off hole. Kevin Streelman holds his trophy aloft after winning the Par 3 Contest on a play off against Camilo Villegas . Streelman therefore became the latest player to be saddled with the curse of the par three champion with no player ever becoming par three and Masters champion in the same year. However that was placed firmly into perspective thanks to his 11 year old caddie Ethan Couch who has a benign but inoperable brain tumour. Streelman found Couch via the Make a Wish Foundation and invited him to be his caddie in the light hearted curtain raiser. Augusta National s par three course traditionally hosts the contest the day before start of the major . It was a really fun day especially to have Ethan with me here Streelman said. This is not about me today. It s about helping him out and showing him a great day. Villegas said I have made a few hole in ones but it s pretty special to make them here. The second one we were a little more emotional there. We just kind of jumped. Nicklaus had earlier holed out with an eight iron from 123 yards on the fourth his ball landing around 15 feet past the pin and spinning back into the hole. Woods played in the Masters par three contest at Augusta National for the first time in 11 years . That took the 75 year old six time champion to three under par but he would bogey the fifth and hit two balls into the water on the ninth to end his hopes of an unlikely triumph. Former US Open champion Curtis Strange reminded Nicklaus of the tradition that players who make a hole in one have to buy the drinks in the clubhouse when Nicklaus walked past the ESPN commentary position. Send me a bill Nicklaus replied. The Masters official Twitter account shared an image of Rory McIlroy and Tiger Woods with Niall Horan . The 18 time major winner added on ESPN I never had a hole in one at Augusta in the par three contest or on the golf course. Doing an interview this morning I said all I have to do is go out there make a hole in one and win the par three. I had it three under and then choked. Since the contest started in 1960 nobody has ever become par three and Masters champion in the same week a fact which sometimes sees players deliberately not shoot the best score possible. Most treat it as light relief and invite family or friends to act as their caddies including Tiger Woods this year for the first time since 2004. Woods had his children Charlie and Sam on his bag and made sure he could not win the event by getting daughter Sam to tap in for par on the sixth. Jack Nicklaus centre with Ben Crenshaw left and Gary Player right during the Par 3 Contest . We had an absolutely great time. These were memories for a lifetime said Woods who was also accompanied by girlfriend Lindsey Vonn. He later added on Twitter I will always have memories of my pop at Augusta and now Sam & Charlie. An amazing day. Tournament favourite Rory McIlroy had One Direction singer Niall Horan acting as his caddie and Horan proved he should stick to singing after badly hooking a tee shot on the ninth into the water. I apologise to golf Horan joked. I do perform to a lot of people but we were performing to their parents today! There was a lot of pressure. McIlroy who is looking to become the sixth player to complete the career grand slam by winning a first Masters title on Sunday added I wanted to do this because it s a big week for me and just to go into the tournament in a relaxed mood. To spend a couple of hours like this was fun.,"Jack Nicklaus recorded his first ever hole in one at the Masters on Wednesday as Camilo Villegas fired two in the space of five holes but still could not win the traditional par three contest.
Villegas holed out on the fourth and eighth as he finished alongside Kevin Streelman on five under par only to find water on the eighth when he played it again as the third play off hole.
Kevin Streelman holds his trophy aloft after winning the Par 3 Contest on a play off against Camilo Villegas .
Streelman therefore became the latest player to be saddled with the curse of the par three champion with no player ever becoming par three and Masters champion in the same year.
However that was placed firmly into perspective thanks to his 11 year old caddie Ethan Couch who has a benign but inoperable brain tumour.",Jack Nicklaus recorded his first ever hole in one at the Masters on Wednesday as Camilo Villegas fired two in the space of five holes but still could not win the traditional par three contest. Streelman found Couch via the Make a Wish Foundation and invited him to be his caddie in the light hearted curtain raiser. It was a really fun day especially to have Ethan with me here Streelman said. Villegas said I have made a few hole in ones but it s pretty special to make them here. The second one we were a little more emotional there. Former US Open champion Curtis Strange reminded Nicklaus of the tradition that players who make a hole in one have to buy the drinks in the clubhouse when Nicklaus walked past the ESPN commentary position.,Jack Nicklaus recorded his first hole in one at the par three contest on a play off .nhis 11 year old caddie Ethan Couch has a benign but inoperable brain tumour .nthe tournament traditionally hosts the day before start of the major .,"Kevin Streelman won the Par 3 Contest at Augusta National, beating Camilo Villegas in a play-off, but he is now unable to continue his battle for the traditional Masters. The Par 3 champion is said to be cursed and Villegas quickly succumbed to the omen. Jack Nicklaus recorded his first ever hole in one during the tournament and Woods played in the Masters par three contest for the first time in 11 years. Since the event began in 1960, no one has managed to win the par three competition and go on to win the Masters in the same week. Rory McIlroy played with Niall Horan acting as his caddy.","Jack Nicklaus achieved his first hole-in-one at the Masters during the par-three contest, on a day highlighted by Camilo Villegas' two aces within five holes. Despite Villegas' impressive performance, Kevin Streelman won the contest in a playoff, continuing the trend where no par-three contest winner has also won the Masters in the same year. Streelman shared the limelight with his 11-year-old caddie, Ethan Couch, who is battling a benign but inoperable brain tumor, fulfilling a wish through the Make-A-Wish Foundation. The event was filled with memorable moments, including celebrity caddies like Niall Horan for Rory McIlroy, and Tiger Woods participating for the first time in 11 years, sharing the experience with his children. Amidst the light-hearted competition, the longstanding tradition of no player winning both the par-three and the main tournament in the same year remained intact.",camilo villegas shot two in the space of five holes but still couldn't win the traditional par three contest. nicklaus'caddie ethan couch has a benign but inoperable brain tumour. the 18 time major winner added on espn i never had a hole in one at augusta in the par three contests or on the golf course.,Kevin Streelman won the Par 3 Contest on a play off against Camilo Villegas. No player has ever become par three and Masters champion in the same year. Jack Nicklaus recorded his first ever hole in one at the Masters on Wednesday. Augusta National's par three course traditionally hosts the,"Jack Nicklaus recorded his first ever hole in one at the Masters on Wednesday as Camilo Villegas fired two in the space of five holes but still could not win the traditional par three contest.
Villegas holed out on the fourth and eighth as he finished alongside Kevin Streelman on"
